{"format_version":3,"worker_count":13,"start":{"managed_tiles":[{"x":0,"y":0,"state":{"kind":"crop","crop":3,"animal":-1,"age_days":11,"stored_units":2,"consecutive_dry_days":1,"pending_care_bonus":0,"fertilizer_days_remaining":1,"watered_today":false,"fed_today":false,"cared_today":false,"fertilizer_available":false}},{"x":1,"y":0,"state":{"kind":"crop","crop":3,"animal":-1,"age_days":11,"stored_units":2,"consecutive_dry_days":0,"pending_care_bonus":0,"fertilizer_days_remaining":1,"watered_today":false,"fed_today":false,"cared_today":false,"fertilizer_available":false}},{"x":2,"y":0,"state":{"kind":"crop","crop":3,"animal":-1,"age_days":11,"stored_units":0,"consecutive_dry_days":0,"pending_care_bonus":0,"fertilizer_days_remaining":1,"watered_today":false,"fed_today":false,"cared_today":false,"fertilizer_available":false}},{"x":3,"y":0,"state":{"kind":"crop","crop":3,"animal":-1,"age_days":11,"stored_units":0,"consecutive_dry_days":0,"pending_care_bonus":0,"fertilizer_days_remaining":1,"watered_today":false,"fed_today":false,"cared_today":false,"fertilizer_available":false}},{"x":4,"y":0,"state":{"kind":"pasture","crop":-1,"animal":11,"age_days":11,"stored_units":0,"consecutive_dry_days":0,"pending_care_bonus":2,"fertilizer_days_remaining":0,"watered_today":false,"fed_today":false,"cared_today":false,"fertilizer_available":true}},{"x":5,"y":0,"state":{"kind":"crop","crop":3,"animal":-1,"age_days":15,"stored_units":0,"consecutive_dry_days":0,"pending_care_bonus":0,"fertilizer_days_remaining":1,"watered_today":false,"fed_today":false,"cared_today":false,"fertilizer_available":false}},{"x":6,"y":0,"state":{"kind":"crop","crop":3,"animal":-1,"age_days":15,"stored_units":0,"consecutive_dry_days":0,"pending_care_bonus":0,"fertilizer_days_remaining":1,"watered_today":false,"fed_today":false,"cared_today":false,"fertilizer_available":false}},{"x":7,"y":0,"state":{"kind":"crop","crop":3,"animal":-1,"age_days":15,"stored_units":0,"consecutive_dry_days":0,"pending_care_bonus":0,"fertilizer_days_remaining":1,"watered_today":false,"fed_today":false,"cared_today":false,"fertilizer_available":false}},{"x":8,"y":0,"state":{"kind":"crop","crop":0,"animal":-1,"age_days":4,"stored_units":3,"consecutive_dry_days":0,"pending_care_bonus":0,"fertilizer_days_remaining":0,"watered_today":false,"fed_today":false,"cared_today":false,"fertilizer_available":false}},{"x":9,"y":0,"state":{"kind":"crop","crop":0,"animal":-1,"age_days":3,"stored_units":2,"consecutive_dry_days":0,"pending_care_bonus":0,"fertilizer_days_remaining":0,"watered_today":false,"fed_today":false,"cared_today":false,"fertilizer_available":false}},{"x":0,"y":1,"state":{"kind":"crop","crop":3,"animal":-1,"age_days":17,"stored_units":0,"consecutive_dry_days":0,"pending_care_bonus":0,"fertilizer_days_remaining":0,"watered_today":false,"fed_today":false,"cared_today":false,"fertilizer_available":false}},{"x":1,"y":1,"state":{"kind":"crop","crop":3,"animal":-1,"age_days":17,"stored_units":0,"consecutive_dry_days":0,"pending_care_bonus":0,"fertilizer_days_remaining":1,"watered_today":false,"fed_today":false,"cared_today":false,"fertilizer_available":false}},{"x":2,"y":1,"state":{"kind":"crop","crop":3,"animal":-1,"age_days":17,"stored_units":0,"consecutive_dry_days":0,"pending_care_bonus":0,"fertilizer_days_remaining":0,"watered_today":false,"fed_today":false,"cared_today":false,"fertilizer_available":false}},{"x":3,"y":1,"state":{"kind":"crop","crop":3,"animal":-1,"age_days":17,"stored_units":0,"consecutive_dry_days":0,"pending_care_bonus":0,"fertilizer_days_remaining":0,"watered_today":false,"fed_today":false,"cared_today":false,"fertilizer_available":false}},{"x":4,"y":1,"state":{"kind":"crop","crop":3,"animal":-1,"age_days":17,"stored_units":0,"consecutive_dry_days":0,"pending_care_bonus":0,"fertilizer_days_remaining":0,"watered_today":false,"fed_today":false,"cared_today":false,"fertilizer_available":false}},{"x":5,"y":1,"state":{"kind":"crop","crop":0,"animal":-1,"age_days":3,"stored_units":3,"consecutive_dry_days":0,"pending_care_bonus":0,"fertilizer_days_remaining":2,"watered_today":false,"fed_today":false,"cared_today":false,"fertilizer_available":false}},{"x":6,"y":1,"state":{"kind":"crop","crop":3,"animal":-1,"age_days":14,"stored_units":2,"consecutive_dry_days":0,"pending_care_bonus":0,"fertilizer_days_remaining":2,"watered_today":false,"fed_today":false,"cared_today":false,"fertilizer_available":false}},{"x":7,"y":1,"state":{"kind":"crop","crop":3,"animal":-1,"age_days":14,"stored_units":2,"consecutive_dry_days":0,"pending_care_bonus":0,"fertilizer_days_remaining":2,"watered_today":false,"fed_today":false,"cared_today":false,"fertilizer_available":false}},{"x":8,"y":1,"state":{"kind":"crop","crop":0,"animal":-1,"age_days":2,"stored_units":1,"consecutive_dry_days":1,"pending_care_bonus":0,"fertilizer_days_remaining":0,"watered_today":false,"fed_today":false,"cared_today":false,"fertilizer_available":false}},{"x":9,"y":1,"state":{"kind":"crop","crop":0,"animal":-1,"age_days":2,"stored_units":1,"consecutive_dry_days":1,"pending_care_bonus":0,"fertilizer_days_remaining":0,"watered_today":false,"fed_today":false,"cared_today":false,"fertilizer_available":false}},{"x":0,"y":2,"state":{"kind":"pasture","crop":-1,"animal":11,"age_days":15,"stored_units":3,"consecutive_dry_days":0,"pending_care_bonus":0,"fertilizer_days_remaining":0,"watered_today":false,"fed_today":false,"cared_today":false,"fertilizer_available":true}},{"x":1,"y":2,"state":{"kind":"crop","crop":3,"animal":-1,"age_days":13,"stored_units":0,"consecutive_dry_days":0,"pending_care_bonus":0,"fertilizer_days_remaining":1,"watered_today":false,"fed_today":false,"cared_today":false,"fertilizer_available":false}},{"x":2,"y":2,"state":{"kind":"crop","crop":3,"animal":-1,"age_days":13,"stored_units":0,"consecutive_dry_days":0,"pending_care_bonus":0,"fertilizer_days_remaining":0,"watered_today":false,"fed_today":false,"cared_today":false,"fertilizer_available":false}},{"x":3,"y":2,"state":{"kind":"pasture","crop":-1,"animal":11,"age_days":16,"stored_units":0,"consecutive_dry_days":1,"pending_care_bonus":1,"fertilizer_days_remaining":0,"watered_today":false,"fed_today":false,"cared_today":false,"fertilizer_available":true}},{"x":4,"y":2,"state":{"kind":"pasture","crop":-1,"animal":11,"age_days":21,"stored_units":4,"consecutive_dry_days":0,"pending_care_bonus":1,"fertilizer_days_remaining":0,"watered_today":false,"fed_today":false,"cared_today":false,"fertilizer_available":true}},{"x":5,"y":2,"state":{"kind":"coop","crop":-1,"animal":9,"age_days":14,"stored_units":2,"consecutive_dry_days":0,"pending_care_bonus":1,"fertilizer_days_remaining":0,"watered_today":false,"fed_today":false,"cared_today":false,"fertilizer_available":true}},{"x":6,"y":2,"state":{"kind":"crop","crop":3,"animal":-1,"age_days":10,"stored_units":2,"consecutive_dry_days":0,"pending_care_bonus":0,"fertilizer_days_remaining":2,"watered_today":false,"fed_today":false,"cared_today":false,"fertilizer_available":false}},{"x":7,"y":2,"state":{"kind":"crop","crop":3,"animal":-1,"age_days":10,"stored_units":2,"consecutive_dry_days":0,"pending_care_bonus":0,"fertilizer_days_remaining":2,"watered_today":false,"fed_today":false,"cared_today":false,"fertilizer_available":false}},{"x":8,"y":2,"state":{"kind":"crop","crop":3,"animal":-1,"age_days":10,"stored_units":1,"consecutive_dry_days":0,"pending_care_bonus":0,"fertilizer_days_remaining":0,"watered_today":false,"fed_today":false,"cared_today":false,"fertilizer_available":false}},{"x":9,"y":2,"state":{"kind":"crop","crop":0,"animal":-1,"age_days":2,"stored_units":1,"consecutive_dry_days":1,"pending_care_bonus":0,"fertilizer_days_remaining":0,"watered_today":false,"fed_today":false,"cared_today":false,"fertilizer_available":false}},{"x":0,"y":3,"state":{"kind":"crop","crop":0,"animal":-1,"age_days":2,"stored_units":1,"consecutive_dry_days":1,"pending_care_bonus":0,"fertilizer_days_remaining":0,"watered_today":false,"fed_today":false,"cared_today":false,"fertilizer_available":false}},{"x":1,"y":3,"state":{"kind":"crop","crop":0,"animal":-1,"age_days":1,"stored_units":1,"consecutive_dry_days":0,"pending_care_bonus":0,"fertilizer_days_remaining":0,"watered_today":false,"fed_today":false,"cared_today":false,"fertilizer_available":false}},{"x":2,"y":3,"state":{"kind":"crop","crop":0,"animal":-1,"age_days":2,"stored_units":1,"consecutive_dry_days":1,"pending_care_bonus":0,"fertilizer_days_remaining":0,"watered_today":false,"fed_today":false,"cared_today":false,"fertilizer_available":false}},{"x":3,"y":3,"state":{"kind":"pasture","crop":-1,"animal":11,"age_days":21,"stored_units":3,"consecutive_dry_days":0,"pending_care_bonus":1,"fertilizer_days_remaining":0,"watered_today":false,"fed_today":false,"cared_today":false,"fertilizer_available":true}},{"x":4,"y":3,"state":{"kind":"pasture","crop":-1,"animal":10,"age_days":21,"stored_units":0,"consecutive_dry_days":1,"pending_care_bonus":1,"fertilizer_days_remaining":0,"watered_today":false,"fed_today":false,"cared_today":false,"fertilizer_available":true}},{"x":5,"y":3,"state":{"kind":"coop","crop":-1,"animal":9,"age_days":13,"stored_units":2,"consecutive_dry_days":0,"pending_care_bonus":1,"fertilizer_days_remaining":0,"watered_today":false,"fed_today":false,"cared_today":false,"fertilizer_available":true}},{"x":6,"y":3,"state":{"kind":"crop","crop":0,"animal":-1,"age_days":2,"stored_units":1,"consecutive_dry_days":1,"pending_care_bonus":0,"fertilizer_days_remaining":0,"watered_today":false,"fed_today":false,"cared_today":false,"fertilizer_available":false}},{"x":7,"y":3,"state":{"kind":"crop","crop":0,"animal":-1,"age_days":2,"stored_units":1,"consecutive_dry_days":1,"pending_care_bonus":0,"fertilizer_days_remaining":0,"watered_today":false,"fed_today":false,"cared_today":false,"fertilizer_available":false}},{"x":8,"y":3,"state":{"kind":"crop","crop":3,"animal":-1,"age_days":12,"stored_units":2,"consecutive_dry_days":0,"pending_care_bonus":0,"fertilizer_days_remaining":0